{
  "schemaVersion": 1,
  "app": "revAgent",
  "component": "bridge",
  "action": "install",
  "computerName": "PETRUCCI",
  "userName": "labadmin",
  "dryRun": false,
  "status": "success",
  "message": "Install completed.",
  "startedAtUtc": "2026-09-03T09:00:00.0000000Z",
  "completedAtUtc": "2026-09-03T09:01:12.0000000Z",
  "steps": [
    { "target": "C:\\stage\\bridge-release.json", "action": "verify_signature", "status": "verified", "detail": null },
    { "target": "C:\\stage", "action": "verify_component_hashes", "status": "verified", "detail": null },
    { "target": "C:\\Program Files\\revAgent\\Bridge", "action": "create_install_root", "status": "applied", "detail": "C:\\Program Files\\revAgent\\Bridge" },
    { "target": "C:\\Program Files\\revAgent\\Bridge\\versions\\current", "action": "create_worker_directory", "status": "applied", "detail": "C:\\Program Files\\revAgent\\Bridge\\versions\\current" },
    { "target": "C:\\ProgramData\\revAgent\\bridge", "action": "create_state_root", "status": "applied", "detail": "C:\\ProgramData\\revAgent\\bridge" },
    { "target": "C:\\ProgramData\\revAgent\\bridge\\credentials", "action": "create_credential_directory", "status": "applied", "detail": "C:\\ProgramData\\revAgent\\bridge\\credentials" },
    { "target": "C:\\Program Files\\revAgent\\Bridge\\revagent-bridge-host.exe", "action": "deploy_host_executable", "status": "applied", "detail": "C:\\Program Files\\revAgent\\Bridge\\revagent-bridge-host.exe" },
    { "target": "C:\\Program Files\\revAgent\\Bridge\\versions\\current", "action": "deploy_worker_payload", "status": "applied", "detail": "C:\\Program Files\\revAgent\\Bridge\\versions\\current" },
    { "target": "C:\\ProgramData\\revAgent\\bridge\\bridge-config.json", "action": "write_bridge_config", "status": "applied", "detail": "C:\\ProgramData\\revAgent\\bridge\\bridge-config.json" },
    { "target": "C:\\Program Files\\revAgent\\Addin\\2022", "action": "deploy_addin_payload", "status": "applied", "detail": "C:\\Program Files\\revAgent\\Addin\\2022" },
    { "target": "C:\\ProgramData\\Autodesk\\Revit\\Addins\\2022\\revAgent.addin", "action": "write_addin_manifest", "status": "applied", "detail": "9f3c2f7e6b1a4d0c8e2f5a7b9c1d3e5f7a9b1c3d5e7f9a1b3c5d7e9f1a3b5c7d" },
    { "target": "revAgentBridge", "action": "register_service", "status": "applied", "detail": "C:\\Program Files\\revAgent\\Bridge\\revagent-bridge-host.exe install" },
    { "target": "C:\\ProgramData\\revAgent\\bridge\\credentials\\enrollment.json", "action": "write_enrollment_artifact", "status": "applied", "detail": "C:\\ProgramData\\revAgent\\bridge\\credentials\\enrollment.json" },
    { "target": "revAgentBridge", "action": "start_service", "status": "applied", "detail": "started" }
  ],
  "install": {
    "revitVersion": "2022",
    "revitDetected": "C:\\Program Files\\Autodesk\\Revit 2022",
    "addinManifestPath": "C:\\ProgramData\\Autodesk\\Revit\\Addins\\2022\\revAgent.addin",
    "addinManifestSha256": "9f3c2f7e6b1a4d0c8e2f5a7b9c1d3e5f7a9b1c3d5e7f9a1b3c5d7e9f1a3b5c7d",
    "serviceName": "revAgentBridge",
    "enrollmentAttempted": true,
    "enrollmentArtifactWritten": true,
    "alreadyEnrolled": false,
    "serviceAlreadyInstalled": false
  },
  "uninstall": null,
  "errors": []
}
